name,url,topic
Creativity: How to Unlock Your Hidden Creative Genius,https://jamesclear.com/creativity,Creativity
For a More Creative Brain Follow These 5 Steps,https://jamesclear.com/five-step-creative-process,Creativity
The Proven Path to Doing Unique and Meaningful Work,https://jamesclear.com/stay-on-the-bus,Creativity
"Creativity Is a Process, Not an Event",https://jamesclear.com/creative-thinking,Creativity
The 15-Minute Routine Anthony Trollope Used to Write 40+ Books,https://jamesclear.com/anthony-trollope,Creativity
"Lessons From a Vexillonaire: Creativity, Simplicity, and the Carefully Constrained Life",https://jamesclear.com/vexillology,Creativity
"The More We Limit Ourselves, the More Resourceful We Become",https://jamesclear.com/kierkegaard-limitations,Creativity
Albert Einstein's Incredible Work Ethic,https://jamesclear.com/albert-einstein-desk,Creativity
6 Famous Artists Talk About What It’s Like to Overcome Fear and Create Beauty,https://jamesclear.com/overcome-fear,Creativity
Never Check Email Before Noon (And Other Thoughts on Doing Your Best Work),https://jamesclear.com/mental-drag,Creativity
Martha Graham on the Hidden Danger of Comparing Yourself to Others,https://jamesclear.com/quality-comparison,Creativity
"Minimalism, Success, and the Curious Writing Habit of George R.R. Martin",https://jamesclear.com/george-rr-martin,Creativity
How Smart Do You Have to Be to Succeed?,https://jamesclear.com/threshold-theory,Creativity
Free Download: Mastering Creativity (1st Edition),https://jamesclear.com/mastering-creativity-1st-edition,Creativity
How to Uncover Your Creative Talent by Using the “Equal Odds Rule”,https://jamesclear.com/equal-odds,Creativity
How Creative Geniuses Come Up With Great Ideas,https://jamesclear.com/markus-zusak,Creativity
How to Solve Big Problems,https://jamesclear.com/narrow-focus,Creativity
Lessons on Sharing Your Gifts With the World From Someone Who Didn't,https://jamesclear.com/vivian-maier,Creativity
Masters of Habit: The Wisdom and Writing of Maya Angelou,https://jamesclear.com/maya-angelou,Creativity
How to Find Your Hidden Creative Genius,https://jamesclear.com/creative-genius,Creativity
Smart People Should Create Things,https://jamesclear.com/create-things,Creativity
Thoughts on Struggling to Finish My First Book,https://jamesclear.com/big-project-syndrome,Creativity
Why I Write,https://jamesclear.com/scale,Creativity
The Myth of Creative Inspiration,https://jamesclear.com/schedule,Creativity
The Weird Strategy Dr. Seuss Used to Create His Greatest Work,https://jamesclear.com/dr-seuss,Creativity
"What Every Successful Person Knows, But Never Says",https://jamesclear.com/ira-glass-failure,Creativity
How to Chase Your Dreams and Reinvent Yourself,https://jamesclear.com/reinvent-yourself,Creativity
Haters and Critics: How to Deal with People Judging You and Your Work,https://jamesclear.com/haters,Creativity
Be Honest: Are You Rejecting Yourself? (Why You Should Make Things),https://jamesclear.com/make-things,Creativity
The Daily Routines of 12 Famous Writers,https://jamesclear.com/daily-routines-writers,Creativity
Make More Art: The Health Benefits of Creativity,https://jamesclear.com/make-more-art,Creativity
The Two Types of Inspiration,https://jamesclear.com/inspiration-types,Creativity
The Difference Between Professionals and Amateurs,https://jamesclear.com/professionals-and-amateurs,Creativity
"The Easiest Way to Live a Short, Unimportant Life",https://jamesclear.com/short-unimportant-life,Creativity
The Decision Making Guide: How to Make Smart Decisions and Avoid Bad Ones,https://jamesclear.com/decision-making,Decision Making
The Ultimate Productivity Hack is Saying No,https://jamesclear.com/saying-no,Decision Making
Why Facts Don’t Change Our Minds,https://jamesclear.com/why-facts-dont-change-minds,Decision Making
How Innovative Ideas Arise,https://jamesclear.com/dont-start-from-scratch,Decision Making
"All Models Are Wrong, Some Are Useful",https://jamesclear.com/all-models-are-wrong,Decision Making
The Downside of Work-Life Balance,https://jamesclear.com/four-burners-theory,Decision Making
The 3 Stages of Failure in Life and Work (And How to Fix Them),https://jamesclear.com/3-stages-of-failure,Decision Making
The Value of Time: How Much is Your Time Really Worth?,https://jamesclear.com/value-of-time,Decision Making
5 Common Mental Errors That Sway You From Making Good Decisions,https://jamesclear.com/common-mental-errors,Decision Making
Overrated vs. Underrated: Common Beliefs We Get Wrong,https://jamesclear.com/overrated-underrated,Decision Making
How Experts Figure What to Focus On,https://jamesclear.com/getting-simple,Decision Making
Warren Buffett's “20 Slot” Rule: How to Simplify Your Life and Maximize Your Results,https://jamesclear.com/buffett-slots,Decision Making
The Ivy Lee Method: The Daily Routine Experts Recommend for Peak Productivity,https://jamesclear.com/ivy-lee,Decision Making
How to Optimize Your Daily Decisions,https://jamesclear.com/design-default,Decision Making
How to Declutter Your Mind and Unleash Your Willpower by Using Bright-Line Rules,https://jamesclear.com/bright-lines,Decision Making
Do More of What Already Works,https://jamesclear.com/checklist-solutions,Decision Making
5 Lessons on Being Wrong,https://jamesclear.com/first-choice,Decision Making
A Different Way of Thinking About Productivity,https://jamesclear.com/time-assets,Decision Making
Warren Buffett's “2 List” Strategy: How to Maximize Your Focus and Master Your Priorities,https://jamesclear.com/buffett-focus,Decision Making
Let Your Values Drive Your Choices,https://jamesclear.com/values-choices,Decision Making
What to Do When You Have Too Many Ideas and Not Enough Time,https://jamesclear.com/pruning,Decision Making
How to be More Productive and Eliminate Time Wasting Activities by Using the “Eisenhower Box”,https://jamesclear.com/eisenhower-box,Decision Making
How Willpower Works: How to Avoid Bad Decisions,https://jamesclear.com/willpower-decision-fatigue,Decision Making
How to Stop Procrastinating by Using the “2-Minute Rule”,https://jamesclear.com/how-to-stop-procrastinating,Decision Making
How to Focus and Concentrate Better,https://jamesclear.com/how-to-focus,Decision Making
Focus: The Ultimate Guide on How to Improve Focus and Concentration,https://jamesclear.com/focus,Focus
The Ultimate Productivity Hack is Saying No,https://jamesclear.com/saying-no,Focus
How Experts Figure What to Focus On,https://jamesclear.com/getting-simple,Focus
Zanshin: Learning the Art of Attention and Focus From a Legendary Samurai Archer,https://jamesclear.com/zanshin,Focus
Warren Buffett's “2 List” Strategy: How to Maximize Your Focus and Master Your Priorities,https://jamesclear.com/buffett-focus,Focus
How to Get Your Brain to Focus on What Matters,https://jamesclear.com/selective-attention,Focus
How to Stay Focused When You Get Bored Working Toward Your Goals,https://jamesclear.com/stay-focused,Focus
How to Focus and Concentrate Better,https://jamesclear.com/how-to-focus,Focus
The Habits Guide: How to Build Good Habits and Break Bad Ones,https://jamesclear.com/habits,Habits
30 One-Sentence Stories From People Who Have Built Better Habits,https://jamesclear.com/one-sentence-habits,Habits
The Ultimate Habit Tracker Guide: Why and How to Track Your Habits,https://jamesclear.com/habit-tracker,Habits
The Surprising Benefits of Journaling One Sentence Every Day,https://jamesclear.com/journaling-one-sentence,Habits
How to Make Your Future Habits Easy,https://jamesclear.com/reset-the-room,Habits
The Habits Scorecard: Use This Simple Exercise to Discover Which Habits You Should Change,https://jamesclear.com/habits-scorecard,Habits
The 1 Percent Rule: Why a Few People Get Most of the Rewards,https://jamesclear.com/the-1-percent-rule,Habits
The Paradox of Behavior Change,https://jamesclear.com/behavior-change-paradox,Habits
How Innovative Ideas Arise,https://jamesclear.com/dont-start-from-scratch,Habits
How to Create a Chain Reaction of Good Habits,https://jamesclear.com/domino-effect,Habits
The Scientific Argument for Mastering One Thing at a Time,https://jamesclear.com/master-one-thing,Habits
Motivation is Overvalued. Environment Often Matters More.,https://jamesclear.com/power-of-environment,Habits
How to Use Military Strategy to Build Better Habits,https://jamesclear.com/sun-tzu-habits,Habits
The Chemistry of Building Better Habits,https://jamesclear.com/chemistry-habits,Habits
How to Stop Lying to Ourselves: A Call for Self-Awareness,https://jamesclear.com/stethoscope-self-awareness,Habits
"The Proven, Reasonable and Totally Unsexy Secret to Success",https://jamesclear.com/habit-creep,Habits
How to Stop Procrastinating and Boost Your Willpower by Using “Temptation Bundling”,https://jamesclear.com/temptation-bundling,Habits
How to Fall in Love With Boredom and Unlock Your Mental Toughness,https://jamesclear.com/in-love-with-boredom,Habits
How to Optimize Your Daily Decisions,https://jamesclear.com/design-default,Habits
How to Declutter Your Mind and Unleash Your Willpower by Using Bright-Line Rules,https://jamesclear.com/bright-lines,Habits
How to Stick With Good Habits Every Day by Using the “Paper Clip Strategy”,https://jamesclear.com/paper-clips,Habits
Use This Simple Daily Habit to Add More Gratitude to Your Life,https://jamesclear.com/gratitude-habit,Habits
The One Word That Drives Senseless and Irrational Habits,https://jamesclear.com/copy-machine-study,Habits
The 5 Triggers That Make New Habits Stick,https://jamesclear.com/habit-triggers,Habits
Why Stores Place Candy by the Checkout Counter (And Why New Habits Fail),https://jamesclear.com/candy-checkout,Habits
5 Common Mistakes That Cause New Habits to Fail,https://jamesclear.com/habits-fail,Habits
Avoid the Second Mistake,https://jamesclear.com/second-mistake,Habits
"Minimalism, Success, and the Curious Writing Habit of George R.R. Martin",https://jamesclear.com/george-rr-martin,Habits
4 Reasonable Ways to Achieve Overnight Success,https://jamesclear.com/multipliers,Habits
3 Simple Ways to Make Exercise a Habit,https://jamesclear.com/exercise-habit,Habits
How to Build Muscle: Strength Lessons from Milo of Croton,https://jamesclear.com/milo,Habits
"This Simple Equation Reveals How Habits Shape Your Health, Happiness, and Wealth",https://jamesclear.com/lewins-equation,Habits
How Vietnam War Veterans Broke Their Heroin Addictions,https://jamesclear.com/heroin-habits,Habits
How to Build New Habits by Taking Advantage of Old Ones,https://jamesclear.com/habit-stacking,Habits
How to Build a New Habit: This is Your Strategy Guide,https://jamesclear.com/habit-guide,Habits
How to Be Motivated Every Day: Lessons Learned from Twyla Tharp,https://jamesclear.com/twyla-tharp,Habits
Masters of Habit: The Wisdom and Writing of Maya Angelou,https://jamesclear.com/maya-angelou,Habits
"How to Change the Habits of 107,000 People",https://jamesclear.com/care-groups,Habits
Plan For Failure: Being Consistent Is Not the Same as Being Perfect,https://jamesclear.com/plan-failure,Habits
How the World Around You Shapes Your Thoughts and Actions,https://jamesclear.com/jonas-salk,Habits
Masters of Habit: The Deliberate Practice and Training of Jerry Rice,https://jamesclear.com/jerry-rice,Habits
How to Change Your Beliefs and Stick to Your Goals for Good,https://jamesclear.com/identity-votes,Habits
I’m Using These 3 Simple Steps to Actually Stick with Good Habits,https://jamesclear.com/small-habits,Habits
How Long Does it Actually Take to Form a New Habit? (Backed by Science),https://jamesclear.com/new-habit,Habits
"Masters of Habit: Rituals, Lessons, and Quotes from Marcus Aurelius",https://jamesclear.com/marcus-aurelius,Habits
"Rome Wasn't Built in a Day, But They Were Laying Bricks Every Hour",https://jamesclear.com/lay-a-brick,Habits
How to Stick With Good Habits Even When Your Willpower is Gone,https://jamesclear.com/choice-architecture,Habits
Why Trying to Be Perfect Won’t Help You Achieve Your Goals (And What Will),https://jamesclear.com/repetitions,Habits
Forget About Setting Goals. Focus on This Instead.,https://jamesclear.com/goals-systems,Habits
Do the Painful Things First,https://jamesclear.com/happiness-pain,Habits
3 Simple Things You Can Do Right Now to Build Better Habits,https://jamesclear.com/good-habits,Habits
How Willpower Works: How to Avoid Bad Decisions,https://jamesclear.com/willpower-decision-fatigue,Habits
How to Stick to Your Goals When Life Gets Crazy,https://jamesclear.com/plan-for-chaos,Habits
How to Stay Focused When You Get Bored Working Toward Your Goals,https://jamesclear.com/stay-focused,Habits
What to Do When You Want to Build Better Habits But Can't Get Started,https://jamesclear.com/awareness-start-better-habits,Habits
The Crime Your Brain Commits Against You,https://jamesclear.com/schemas,Habits
The Daily Routines of 12 Famous Writers,https://jamesclear.com/daily-routines-writers,Habits
How to Stop Procrastinating on Your Goals by Using the “Seinfeld Strategy”,https://jamesclear.com/stop-procrastinating-seinfeld-strategy,Habits
How to Improve Your Health and Productivity Without Thinking,https://jamesclear.com/environment-design-organ-donation,Habits
"You Get 25,000 Mornings as an Adult: Here are 8 Ways to Not Waste Them",https://jamesclear.com/25000-mornings,Habits
"What is Your “Average Speed” in Your Life, Your Health, and Your Work?",https://jamesclear.com/average-speed,Habits
Achieve Your Goals: Research Reveals a Simple Trick That Doubles Your Chances for Success,https://jamesclear.com/implementation-intentions,Habits
How to Break a Bad Habit and Replace It With a Good One,https://jamesclear.com/how-to-break-a-bad-habit,Habits
Get Back on Track: 7 Strategies to Help You Bounce Back After Slipping Up,https://jamesclear.com/get-back-on-track,Habits
"How to Say No, Resist Temptation, and Stick to Your Health Goals",https://jamesclear.com/how-to-say-no,Habits
How to Get Motivated When You Don't Feel Like It,https://jamesclear.com/how-to-get-motivated,Habits
How to Achieve Your Goals Easily,https://jamesclear.com/schedule-goals,Habits
How To Start New Habits That Actually Stick,https://jamesclear.com/three-steps-habit-change,Habits
5 Simple Ways to Be Happy,https://jamesclear.com/be-happy,Habits
How to Stick to Little Healthy Habits (Like Flossing) Without Thinking,https://jamesclear.com/habits-visibility-method,Habits
Why is it So Hard to Stick to Good Habits?,https://jamesclear.com/why-is-it-so-hard-to-form-good-habits,Habits
The Difference Between Professionals and Amateurs,https://jamesclear.com/professionals-and-amateurs,Habits
Identity-Based Habits: How to Actually Stick to Your Goals This Year,https://jamesclear.com/identity-based-habits,Habits
Keystone Habits: The Simple Way to Improve All Aspects of Your Life,https://jamesclear.com/keystone-habits,Habits
Feeling Fat? Use These 2 Easy Ways to Lose Weight,https://jamesclear.com/feeling-fat,Habits
Life Lessons,https://jamesclear.com/life-lessons,Life Lessons
The Ultimate Productivity Hack is Saying No,https://jamesclear.com/saying-no,Life Lessons
When the 80/20 Rule Fails: The Downside of Being Effective,https://jamesclear.com/the-downside-of-being-effective,Life Lessons
Absolute Success is Luck. Relative Success is Hard Work.,https://jamesclear.com/luck-vs-hard-work,Life Lessons
Why Facts Don’t Change Our Minds,https://jamesclear.com/why-facts-dont-change-minds,Life Lessons
The Shadow Side of Greatness,https://jamesclear.com/shadow-side,Life Lessons
The Downside of Work-Life Balance,https://jamesclear.com/four-burners-theory,Life Lessons
The Proven Path to Doing Unique and Meaningful Work,https://jamesclear.com/stay-on-the-bus,Life Lessons
Make Your Life Better by Saying Thank You in These 7 Situations,https://jamesclear.com/say-thank-you,Life Lessons
One Research-Backed Way to Effectively Manage Your Stressful and Busy Schedule,https://jamesclear.com/personal-values-journal,Life Lessons
Scott Dinsmore: A Tribute,https://jamesclear.com/scott-dinsmore,Life Lessons
How to Be Happy When Everything Goes Wrong,https://jamesclear.com/impact-bias,Life Lessons
This Zen Concept Will Help You Stop Being a Slave to Old Beliefs,https://jamesclear.com/shoshin,Life Lessons
Why Old Ideas Are a Secret Weapon,https://jamesclear.com/old-ideas,Life Lessons
Overrated vs. Underrated: Common Beliefs We Get Wrong,https://jamesclear.com/overrated-underrated,Life Lessons
"It's Not Just About What You Say, It's About How You Live",https://jamesclear.com/gratitude-gestures,Life Lessons
How Experts Figure What to Focus On,https://jamesclear.com/getting-simple,Life Lessons
Famous Biologist Louis Agassiz on the Usefulness of Learning Through Observation,https://jamesclear.com/louis-agassiz,Life Lessons
What I Do When I Feel Like Giving Up,https://jamesclear.com/giving-up,Life Lessons
You’re Not Ready for Marriage,https://jamesclear.com/marriage-ready,Life Lessons
Use This Simple Daily Habit to Add More Gratitude to Your Life,https://jamesclear.com/gratitude-habit,Life Lessons
5 Lessons on Being Wrong,https://jamesclear.com/first-choice,Life Lessons
Joseph Brodsky Explains Perfectly How to Deal With Critics and Detractors in Your Life,https://jamesclear.com/joseph-brodsky,Life Lessons
What I Do When it Feels Like My Work Isn't Good Enough,https://jamesclear.com/self-judgment,Life Lessons
Martha Graham on the Hidden Danger of Comparing Yourself to Others,https://jamesclear.com/quality-comparison,Life Lessons
Lessons on Living a Meaningful Life from Nichelle Nichols,https://jamesclear.com/nichelle-nichols,Life Lessons
How to Build Skills That Are Valuable,https://jamesclear.com/ingvar-kamprad,Life Lessons
Do Things You Can Sustain,https://jamesclear.com/upper-bound,Life Lessons
Let Your Values Drive Your Choices,https://jamesclear.com/values-choices,Life Lessons
Thoughts on Struggling to Finish My First Book,https://jamesclear.com/big-project-syndrome,Life Lessons
"Masters of Habit: Rituals, Lessons, and Quotes from Marcus Aurelius",https://jamesclear.com/marcus-aurelius,Life Lessons
I Watched an Artist Create Stained Glass And Learned An Important Lesson About Life,https://jamesclear.com/inside-cuts,Life Lessons
"Feeling Uncertain Doesn't Make You Weak, Weird, or Unqualified",https://jamesclear.com/uncertain,Life Lessons
Do You Have to be Unhappy Now if You Want to be Successful Later?,https://jamesclear.com/happy-driven,Life Lessons
How to Be Thankful For Your Life by Changing Just One Word,https://jamesclear.com/how-to-be-thankful,Life Lessons
You're Not Good Enough to Be Disappointed,https://jamesclear.com/good-disappointed,Life Lessons
Haters and Critics: How to Deal with People Judging You and Your Work,https://jamesclear.com/haters,Life Lessons
Random Ideas About Life,https://jamesclear.com/random-ideas-about-life,Life Lessons
What if You Treated Your Life Like a Team Sport?,https://jamesclear.com/life-team-sport,Life Lessons
The Magic of Committing to a Specific Goal,https://jamesclear.com/magic-of-committing,Life Lessons
What Does it Mean to Live a Healthy Life?,https://jamesclear.com/what-does-it-mean-to-live-a-healthy-life,Life Lessons
The Top Life Regret of Dying Hospital Patients,https://jamesclear.com/top-regret-dying-people,Life Lessons
116 Years Old: Lessons Left Behind From the World's Oldest Living Person,https://jamesclear.com/116-years-old-lessons-oldest-living-person,Life Lessons
"The Easiest Way to Live a Short, Unimportant Life",https://jamesclear.com/short-unimportant-life,Life Lessons
How to Be Happy: A Surprising Lesson on Happiness From an African Tribe,https://jamesclear.com/how-can-i-be-happy-if-you-are-sad,Life Lessons
Motivation: The Scientific Guide on How to Get and Stay Motivated,https://jamesclear.com/motivation,Motivation
The Goldilocks Rule: How to Stay Motivated in Life and Business,https://jamesclear.com/goldilocks-rule,Motivation
World Chess Champion Garry Kasparov on How to Build Confidence,https://jamesclear.com/kasparov-confidence,Motivation
What I Do When I Feel Like Giving Up,https://jamesclear.com/giving-up,Motivation
Fear vs. Ambition,https://jamesclear.com/fear-vs-ambition,Motivation
6 Famous Artists Talk About What It’s Like to Overcome Fear and Create Beauty,https://jamesclear.com/overcome-fear,Motivation
Joseph Brodsky Explains Perfectly How to Deal With Critics and Detractors in Your Life,https://jamesclear.com/joseph-brodsky,Motivation
What I Do When it Feels Like My Work Isn't Good Enough,https://jamesclear.com/self-judgment,Motivation
Martha Graham on the Hidden Danger of Comparing Yourself to Others,https://jamesclear.com/quality-comparison,Motivation
Sisu: How to Develop Mental Toughness in the Face of Adversity,https://jamesclear.com/sisu-mental-toughness,Motivation
Lessons on Living a Meaningful Life from Nichelle Nichols,https://jamesclear.com/nichelle-nichols,Motivation
How to Be Motivated Every Day: Lessons Learned from Twyla Tharp,https://jamesclear.com/twyla-tharp,Motivation
Plan For Failure: Being Consistent Is Not the Same as Being Perfect,https://jamesclear.com/plan-failure,Motivation
"Masters of Habit: Rituals, Lessons, and Quotes from Marcus Aurelius",https://jamesclear.com/marcus-aurelius,Motivation
The Myth of Creative Inspiration,https://jamesclear.com/schedule,Motivation
The Power of Imperfect Starts,https://jamesclear.com/optimal,Motivation
"Rome Wasn't Built in a Day, But They Were Laying Bricks Every Hour",https://jamesclear.com/lay-a-brick,Motivation
"Feeling Uncertain Doesn't Make You Weak, Weird, or Unqualified",https://jamesclear.com/uncertain,Motivation
"What Every Successful Person Knows, But Never Says",https://jamesclear.com/ira-glass-failure,Motivation
You're Not Good Enough to Be Disappointed,https://jamesclear.com/good-disappointed,Motivation
How to Chase Your Dreams and Reinvent Yourself,https://jamesclear.com/reinvent-yourself,Motivation
Haters and Critics: How to Deal with People Judging You and Your Work,https://jamesclear.com/haters,Motivation
The Fight is the Reward,https://jamesclear.com/fight-reward,Motivation
The “Chosen Ones” Choose Themselves,https://jamesclear.com/chosen-ones,Motivation
5 Thoughts on Overcoming Fear and Self-Doubt,https://jamesclear.com/overcoming-fear,Motivation
"If You Commit to Nothing, You'll Be Distracted By Everything",https://jamesclear.com/mental-toughness-marathon-monks,Motivation
It’s Not Your Job to Tell Yourself “No”,https://jamesclear.com/your-job,Motivation
The Two Types of Inspiration,https://jamesclear.com/inspiration-types,Motivation
Learning From Superhumans: The Incredible Fitness and Success of Jack LaLanne,https://jamesclear.com/superhumans-jack-lalanne,Motivation
Get Back on Track: 7 Strategies to Help You Bounce Back After Slipping Up,https://jamesclear.com/get-back-on-track,Motivation
How to Get Motivated When You Don't Feel Like It,https://jamesclear.com/how-to-get-motivated,Motivation
The Magic of Committing to a Specific Goal,https://jamesclear.com/magic-of-committing,Motivation
"Move Towards the Next Thing, Not Away From the Last Thing",https://jamesclear.com/move-towards-the-next-thing-not-away-from-the-last-thing,Motivation
The Top Life Regret of Dying Hospital Patients,https://jamesclear.com/top-regret-dying-people,Motivation
Are You Living an Urgent Life or an Important Life?,https://jamesclear.com/are-you-living-an-urgent-life-or-an-important-one,Motivation
116 Years Old: Lessons Left Behind From the World's Oldest Living Person,https://jamesclear.com/116-years-old-lessons-oldest-living-person,Motivation
"The Easiest Way to Live a Short, Unimportant Life",https://jamesclear.com/short-unimportant-life,Motivation
Believe in Yourself (And Why Nothing Will Work If You Don't…),https://jamesclear.com/nothing-will-work-if-you-dont-believe-in-it,Motivation
Successful People Start Before They Feel Ready,https://jamesclear.com/successful-people-start-before-they-feel-ready,Motivation
The Productivity Guide: Time Management Strategies That Work,https://jamesclear.com/productivity,Productivity
When the 80/20 Rule Fails: The Downside of Being Effective,https://jamesclear.com/the-downside-of-being-effective,Productivity
7 Ways to Retain More of Every Book You Read,https://jamesclear.com/reading-comprehension-strategies,Productivity
For a More Creative Brain Follow These 5 Steps,https://jamesclear.com/five-step-creative-process,Productivity
How to Create a Chain Reaction of Good Habits,https://jamesclear.com/domino-effect,Productivity
The 15-Minute Routine Anthony Trollope Used to Write 40+ Books,https://jamesclear.com/anthony-trollope,Productivity
The Ivy Lee Method: The Daily Routine Experts Recommend for Peak Productivity,https://jamesclear.com/ivy-lee,Productivity
How to Stick With Good Habits Every Day by Using the “Paper Clip Strategy”,https://jamesclear.com/paper-clips,Productivity
The Myth of Multitasking: Why Fewer Priorities Leads to Better Work,https://jamesclear.com/multitasking-myth,Productivity
Never Check Email Before Noon (And Other Thoughts on Doing Your Best Work),https://jamesclear.com/mental-drag,Productivity
A Different Way of Thinking About Productivity,https://jamesclear.com/time-assets,Productivity
Warren Buffett's “2 List” Strategy: How to Maximize Your Focus and Master Your Priorities,https://jamesclear.com/buffett-focus,Productivity
“Email is Where Keystrokes Go to Die.”,https://jamesclear.com/keystrokes,Productivity
The Physics of Productivity: Newton's Laws of Getting Stuff Done,https://jamesclear.com/physics-productivity,Productivity
How to Read More: The Simple System I'm Using to Read 30+ Books Per Year,https://jamesclear.com/read-more,Productivity
The Only Productivity Tip You'll Ever Need,https://jamesclear.com/productivity-tip,Productivity
How to be More Productive and Eliminate Time Wasting Activities by Using the “Eisenhower Box”,https://jamesclear.com/eisenhower-box,Productivity
